{"schema_version":"pysolate.study-summary.v1","source_sha256":"sha256:96471d39c04f3382696a858021bcb83f675f274a6d7de1f2450057e82beec71a","generated_at_policy":"omitted","study_id":"study-private","evidence_class":"mechanism_only","workload_count":1,"treatment_count":1,"status_totals":[{"status":"completed","count":1},{"status":"failed","count":0},{"status":"timed_out","count":0},{"status":"unsupported","count":0}],"prohibited_claims":["arbitrary_determinism","computer_replacement","economic_advantage","model_quality","placement_share","production_readiness","token_or_latency_benefit"],"storage":{"logical_bytes":2048,"stored_bytes":1024,"object_count":8,"reused_object_count":2}}